{
  "canonicalization_version": "canonical-json-v1",
  "component_ontology_policy": "USES_EXISTING_COMPONENT_IDS_AND_PRESERVES_TASK_051_SUCCESSOR_DEFINITIONS",
  "contract_version": "system-model-contract-v1",
  "relationships": [
    {
      "authority_boundary": "Domain enrichment only; does not authorize Repair or choose the target instance.",
      "dossier_ids": [
        "model.missing-nvme.v1"
      ],
      "implementation_status": "APPLIED_PROFILE_OVERLAY",
      "justification": "The procedure's required_component_ids is empty even though the service action replaces the isolated NVMe unit.",
      "relation_type": "REPAIR_TARGETS_ROLE_PATH",
      "relationship_id": "gap.relation.repair.replace_nvme.target",
      "source_claim_ids": [
        "claim.r740xd.backplane-serviceable",
        "claim.r740xd.twenty-sas-four-nvme-option"
      ],
      "source_object_ids": [
        "repair.storage.replace_nvme",
        "component.storage.nvme_ssd"
      ],
      "targets": [
        {
          "node_ids": [
            "drives"
          ],
          "path_ids": [
            "path.r740xd.nvme-storage"
          ],
          "profile_id": "profile.dell.poweredge-r740xd.hybrid-24x2_5.v1",
          "role_ids": [
            "role.nvme"
          ]
        }
      ]
    },
    {
      "authority_boundary": "Profile-scoped enrichment; Ticket Isolation still selects the legal instance.",
      "dossier_ids": [
        "model.loose-storage-cable.v1"
      ],
      "implementation_status": "APPLIED_PROFILE_OVERLAY",
      "justification": "One generic required-component list cannot identify the source-backed branch and its two endpoints without collapsing SAS and PCIe/NVMe paths.",
      "relation_type": "REPAIR_TARGETS_ROLE_PATH",
      "relationship_id": "gap.relation.repair.reseat_storage_cable.target",
      "source_claim_ids": [
        "claim.r740xd.sas-perc-path",
        "claim.r740xd.pcie-nvme-path",
        "claim.r740xd.backplane-serviceable"
      ],
      "source_object_ids": [
        "repair.storage.reseat_cable",
        "component.storage.data_cable",
        "component.storage.pcie_nvme_interconnect"
      ],
      "targets": [
        {
          "node_ids": [
            "sas_path",
            "nvme_path",
            "backplane"
          ],
          "path_ids": [
            "path.r740xd.sas-storage",
            "path.r740xd.nvme-storage"
          ],
          "profile_id": "profile.dell.poweredge-r740xd.hybrid-24x2_5.v1",
          "role_ids": [
            "role.sas_cable",
            "role.pcie_cable"
          ]
        }
      ]
    },
    {
      "authority_boundary": "Explanatory/validation enrichment; PASS remains authored.",
      "dossier_ids": [
        "model.missing-nvme.v1",
        "model.loose-storage-cable.v1"
      ],
      "implementation_status": "APPLIED_PROFILE_OVERLAY",
      "justification": "The Verification describes firmware/controller/OS inventory and stable path identity but target_component_ids is empty and cannot express a layered verified path.",
      "relation_type": "VERIFIES_PATH_STATE",
      "relationship_id": "gap.relation.verify.storage_detected.path",
      "source_claim_ids": [
        "claim.idrac9.storage-observation",
        "claim.uefi.os-loader-handoff"
      ],
      "source_object_ids": [
        "verify.storage.device_detected",
        "component.storage.backplane",
        "component.storage.nvme_ssd",
        "component.storage.data_cable"
      ],
      "targets": [
        {
          "node_ids": [
            "bmc",
            "os",
            "backplane",
            "sas_path",
            "nvme_path",
            "drives"
          ],
          "path_ids": [
            "path.r740xd.sas-storage",
            "path.r740xd.nvme-storage"
          ],
          "profile_id": "profile.dell.poweredge-r740xd.hybrid-24x2_5.v1",
          "role_ids": [
            "role.hybrid_backplane",
            "role.nvme",
            "role.sas_drives"
          ]
        }
      ]
    },
    {
      "authority_boundary": "Domain enrichment only; success conditions and authored result remain authoritative.",
      "dossier_ids": [
        "model.missing-nvme.v1"
      ],
      "implementation_status": "APPLIED_PROFILE_OVERLAY",
      "justification": "The Verification checks persistent boot policy and UEFI-to-loader handoff, but no BIOS/UEFI Component or boot-path relation exists.",
      "relation_type": "VERIFIES_PATH_STATE",
      "relationship_id": "gap.relation.verify.normal_boot.handoff",
      "source_claim_ids": [
        "claim.uefi.os-loader-handoff",
        "claim.r740xd.boot-order-configurable"
      ],
      "source_object_ids": [
        "verify.boot.normal_boot",
        "component.firmware.system_bios"
      ],
      "targets": [
        {
          "node_ids": [
            "uefi",
            "os"
          ],
          "path_ids": [
            "path.r740xd.boot-handoff"
          ],
          "profile_id": "profile.dell.poweredge-r740xd.hybrid-24x2_5.v1",
          "role_ids": [
            "role.system_bios"
          ]
        }
      ]
    },
    {
      "authority_boundary": "Does not imply a log outcome or decisive Evidence.",
      "dossier_ids": [
        "model.missing-nvme.v1",
        "model.loose-storage-cable.v1",
        "model.failed-power-distribution.v1"
      ],
      "implementation_status": "APPLIED_PROFILE_OVERLAY",
      "justification": "The Test requires a BMC console but target_component_ids is empty; a queried control surface and Ticket/profile-scoped observed subject are distinct relations.",
      "relation_type": "QUERIES_CONTROL_SURFACE",
      "relationship_id": "gap.relation.test.bmc_logs.surface_subject",
      "source_claim_ids": [
        "claim.idrac9.lifecycle-log-categories",
        "claim.idrac9.storage-observation",
        "claim.r740xd2.psu-mismatch-reporting"
      ],
      "source_object_ids": [
        "test.system.bmc_logs",
        "component.management.bmc"
      ],
      "targets": [
        {
          "node_ids": [
            "bmc",
            "backplane",
            "drives"
          ],
          "path_ids": [
            "path.r740xd.management-storage"
          ],
          "profile_id": "profile.dell.poweredge-r740xd.hybrid-24x2_5.v1",
          "role_ids": [
            "role.bmc"
          ]
        },
        {
          "node_ids": [
            "bmc",
            "board"
          ],
          "path_ids": [
            "path.r740xd2.power-status"
          ],
          "profile_id": "profile.dell.poweredge-r740xd2.power-interposer.v1",
          "role_ids": [
            "role.bmc"
          ]
        }
      ]
    },
    {
      "authority_boundary": "Observation scope only; Evidence rules remain authored.",
      "dossier_ids": [
        "model.missing-nvme.v1",
        "model.loose-storage-cable.v1"
      ],
      "implementation_status": "APPLIED_PROFILE_OVERLAY",
      "justification": "The Test compares firmware, controller, and OS layers while target_component_ids is empty; one flat component list cannot preserve layer/path semantics.",
      "relation_type": "OBSERVES_COMPONENT_PATH",
      "relationship_id": "gap.relation.test.storage_inventory.layers",
      "source_claim_ids": [
        "claim.idrac9.hardware-inventory",
        "claim.idrac9.storage-observation"
      ],
      "source_object_ids": [
        "test.storage.device_inventory",
        "component.storage.backplane",
        "component.storage.nvme_ssd",
        "component.storage.raid_controller"
      ],
      "targets": [
        {
          "node_ids": [
            "bmc",
            "os",
            "backplane",
            "sas_path",
            "nvme_path",
            "drives"
          ],
          "path_ids": [
            "path.r740xd.management-storage",
            "path.r740xd.sas-storage",
            "path.r740xd.nvme-storage"
          ],
          "profile_id": "profile.dell.poweredge-r740xd.hybrid-24x2_5.v1",
          "role_ids": [
            "role.bmc",
            "role.hybrid_backplane",
            "role.nvme",
            "role.perc"
          ]
        }
      ]
    },
    {
      "authority_boundary": "Requires profile/runtime target binding, not a broad domain edit.",
      "dossier_ids": [
        "model.loose-storage-cable.v1",
        "model.failed-power-distribution.v1",
        "model.incompatible-firmware-set.v1"
      ],
      "implementation_status": "APPLIED_PROFILE_OVERLAY",
      "justification": "A global target list would incorrectly include every inspectable component; the concrete target belongs to the selected profile and Ticket action target.",
      "relation_type": "OBSERVES_COMPONENT_PATH",
      "relationship_id": "gap.relation.test.visual_inspection.binding",
      "source_claim_ids": [
        "claim.r740xd.backplane-serviceable",
        "claim.r740xd2.pib-service-unit"
      ],
      "source_object_ids": [
        "test.general.visual_inspection"
      ],
      "targets": [
        {
          "node_ids": [
            "board",
            "backplane",
            "sas_path",
            "nvme_path"
          ],
          "path_ids": [
            "path.r740xd.sas-storage",
            "path.r740xd.nvme-storage"
          ],
          "profile_id": "profile.dell.poweredge-r740xd.hybrid-24x2_5.v1",
          "role_ids": [
            "role.system_board",
            "role.hybrid_backplane",
            "role.sas_cable",
            "role.pcie_cable"
          ]
        },
        {
          "node_ids": [
            "psu",
            "power_interposer",
            "board"
          ],
          "path_ids": [
            "path.r740xd2.power-distribution"
          ],
          "profile_id": "profile.dell.poweredge-r740xd2.power-interposer.v1",
          "role_ids": [
            "role.psu_pair",
            "role.pib",
            "role.system_board"
          ]
        }
      ]
    },
    {